,authors,content,date,img_src,tags,title
148,Steve O'Hear,"Just Eat, the online takeout ordering behemoth, has invested in U.K. startup Flypay, which has built a platform to help restaurant and pub chains consolidate their various and disparate technology solutions. The size of the round is £3.5 million and serves as an extension to the company’s previous Series A that saw it pick up £7 million led by media brand TimeOut.
The investment is also described as a “strategic partnership” and sees Just Eat become the latest tech partner on Flypay’s Flyt platform, which lets restaurants and pubs/bars integrate numerous tech and services, from bookings and loyalty, to things like delivery and reviews.
The startup originally focussed on providing a pay-at-table app to let you settle your restaurant bill “waiter-free,” before adding additional services such as order and collect, order at table, pay at bar and customer loyalty features.
However, it has since realised that there is more value in building a technology stack that doesn’t just compete with but integrates many of the tech solutions the hospitality industry already uses.
“For hospitality operators, our new Flyt platform aims to make it significantly easier to innovate around digital commerce, both in terms of integrating technologies across the customer journey… into their own apps, as well as connecting into the biggest aggregator apps and other platforms, such as messaging, voice commerce and who-knows-what’s-next,” Flypay founder and CEO Tom Weaver tells me.
“Our customers are mainstream casual dining and pubs brands.  We currently work with clients like Wahaca, GBK, Jamie’s Italian, Fuller’s, Chilango, and many others.  We’ve just signed one of the most popular restaurant brands in the U.K., to be announced shortly, to create some uniquely different experiences,” he adds.
To that end, Just Eat and Flypay say they plan to collaborate on “digital experiences” for operators across the casual dining sector. This will see Flypay integrating delivery into restaurant and bars’ own apps, powered by Flyt. But that’s just the start.
There’s also plans to offer Just Eat’s customer base access to in-restaurant experiences, and to work together to make it easier for restaurant, pub and bar operators to “adopt and utilise delivery technology”.
Says David Buttress, CEO of Just Eat, in a statement: “Investing in Flypay will enable us to continue to build a seamless experience for consumers who will be able to order, pay, receive customer care and book delivery through the same product. The technology will help us to enhance our offer to casual dining restaurant chains, enabling them to fulfil delivery using Just Eat. The Flyt platform has the potential to transform the digital journey in the casual dining space and we see huge potential in this technology.”",2016-10-09,https://tctechcrunch2011.files.wordpress.com/2016/10/t-weaver-_-approved-_-24-11-15.jpg?w=738,"flypay,just-eat",Just Eat backs Flypay to help restaurant and pub chains consolidate their tech
149,John Biggs,"If you’re a maker, a hustler, a shaker, or a serial entrepreneur you probably make a lot of websites. There are a number of tools you can use including Bootstrap (please stop using Bootstrap), Squarespace, and a few cool WordPress plugins. Now there’s also Tilda.
Tilda is basically an easy-to-use responsive page builder that costs $15 a month for a standard landing page. Nikita Obukhov, a Russian web designer and owner of the FunkyPunky design studio, created Tilda as an internal tool but wanted to expand into a wider market. He opened the tool up to general users and now you can use it to drag and drop images and text around a page and basically stick something up in seconds.
One of the differentiators is a tool called the Zero Block. Basically its a web editor inside a web editor that lets you manage typography, draw shapes, and even create animations. It’s Tilda’s secret weapon.
“Users build a website from pre-designed blocks. It’s not templates, so it’s quite flexible and users have freedom. On the other hand, these blocks were created by our highly qualified design team so they look good,” said Obukhov.
I built a quick website for a project in about 15 minutes, using a few stock photos and some text. It was up and running moments after I finished and you can easily assign domain names to your creations. It was a very pleasant experience at the very least.
Tilda is self-funded and they have about 4,000 repeat customers.
While you might not be able to escape Bootstrap completely and while $15 per month is still a lot of dosh for a web page Tilda is definitely a tool I’m adding to my hustler/hacker/weirdo/wantrepreneurial arsenal.",2016-10-07,https://tctechcrunch2011.files.wordpress.com/2016/10/img_9478.jpg?w=738,"squarespace,wordpress,free-software,software",Tilda is the web design tool for the rest of us
150,Romain Dillet,"Meet Side, a French startup that until recently was called WeSlash. Side is a marketplace for short-term jobs. Companies may need a few extra hands for a few days or weeks, and students may want to work on the side to make a bit of money or gain experience — Side fills this need and raised $1.5 million (€1.3 million) from Connect Ventures, Fly Ventures, Kima Ventures and TheFamily.
“We make it much simpler to seek a job that you’re going to be able to do while studying,” co-founder and CEO Pierre Mugnier told me. “As for companies, we give them access to students who are available and can legally work.”
Think about it as a sort of “staffing-as-a-service” startup. If you have a big product launch coming up or you want to start a newsletter, you may not want to hire someone full time.
And yet, Side isn’t a typical job board or temp agency. Students on Side are freelancers. Companies hire freelancers for a specific job. And Side facilitates all that.
Let’s say you’re a student. Side helps you register to become a self-employed person. After that, Side handles all the administrative tasks — billing clients, collecting payments and paying you. The company also works with Axa for a public liability insurance for all students. The startup takes a 20 percent cut.
More importantly, Side makes sure that you get paid for what you actually do. “Students get paid for every hour of work, not by task,” Mugnier said. “This way, we can protect students so that they don’t work for nothing.”
The typical salary is €15 per hour ($16.74). After Side’s cut, students end up with €12 per hour ($13.39). Many jobs require you to work 5 to 10 hours a week. So you won’t get rich on Side, but it could be an alternative to being a cashier in a supermarket.
A few startups rely on Side to increase their workforce, such as Uber, Doctolib, Deliveroo, Foodora or Drivy. Bigger companies, such as Sodexo or Caisse d’Epargne, also work with Side.
Side is available in France and the U.K; 10,000 students have registered so far, and 300 companies have tried Side. Eventually, Side wants to optimize its platform so a company can start working with a student in 5 minutes.
But the end game is even more ambitious. Right now, many students in Paris deliver food on restaurant delivery platforms, such as Deliveroo and Foodora. Mugnier told me that students should be able to find jobs that are as flexible as becoming a Deliveroo rider, but for all sorts of jobs.
",2016-10-07,https://tctechcrunch2011.files.wordpress.com/2016/10/side-sider.jpg?w=738,france-newsletter,Side matches students with companies for short-term jobs
151,Steve O'Hear,"
It sees the Silicon Valley-based investor work with the companies accepted into the program to build and test appropriate growth “hacks,” put better metrics and analytics in place and design a long-term user acquisition strategy.
500 Startups also makes a $200,000 investment in each startup (minus a $50,000 program fee) in return for a negotiated amount of equity. It’s being hosted at hub:raum with sponsorship from Deutsche Telekom.
Noteworthy: This isn’t the first time “Distro Dojo” has set up shop in Europe. The program debuted in London last year, and builds on 500 Startups’ growing presence in the continent, which has seen it make around 140 investments in Europe to date. So, why bring “Distro Dojo” to Berlin, in particular?
“I spent nearly four years working in Berlin’s tech sector and quickly realized there were many opportunities and strengths to its ecosystem,” explains Jess Erickson, program director at 500 Startups.
Specifically, she cites the high-caliber of the local business and technical universities, Germany’s more favorable immigration policies compared to the U.K. and what she says is the city’s ability to attract talented people from all over the world.
“I’ve seen an influx of companies founded in Berlin (as well as exits) and am thrilled that 500 Startups is starting to launch programs into Germany to help accelerate the process,” adds Erickson.
Meanwhile, I asked Matt Lerner, partner at 500 Startups and the person who heads up its London office and leads the European Distro Dojo program, to share any learnings so far.
He tells me that 20 companies have come through the London program and, perhaps unsurprisingly, the hypothesis that there was a need for an accelerator of sorts dedicated to growth marketing has been validated.
“There’s a huge need for someone in the pre-Series A space to help companies learn how to scale. Demand for the program has been really high as word starts to spread about what we do,” he says.
However, one thing that has surprised Learner is that a number of the U.K.’s already established and up-and-coming digital marketers have chosen to join the program.
They include Mat Braddy (former CMO of JustEat) with his startup Rock Pamper Scissors, and Tom Beverley (former head of digital marketing for Fab, OneFineStay, and Confused.com) with his new venture Fy.
This has seen 500 Startups beginning to recruit more companies that already have strong marketing teams that, says Lerner, tend to reap the largest benefit. “We’ve shifted the focus more towards things [like] analytics, usability testing,” he says.
I also asked Lerner if setting up shop in Berlin, rather than London alone, had anything to do with Brexit? “Alas, it was in the books before the fateful vote,” he tells me. “We’ve long been bent on world domination, and Distro Dojos are a good strategy to really get into a market and see the deal flow and the quality of founders and other investors first-hand.”
As for Brexit itself, “we’re watching and hoping,” he says, and notes that 500 Startups is keeping a keen on eye on important startup issues like immigration policy, harmonized fintech regulations across the continent and the free flow of capital and trade.
Aren’t we all.
Voya.ai simplifies business travel by combining the expertise of travel agents with the efficiency of a chatbot. Offering a concierge-like service on a familiar chat interface, Voya built the simplest way to book and manage business trips. They created the first business travel service that both companies and their users love, which may be why their business is doubling each month.
Junomedical is a digital health platform where patients worldwide are matched with high-quality medical care abroad at an affordable price. Junomedical’s passionate team of digital experts and geeks is led by Dr. Sophie Chung — tackling a $50 billion medical travel industry.
Heycater! lets busy office managers quickly order catering online. Founders Sophie Radtke and Therese Köhler don’t simply plan to unite clients and caterers on a curated platform; their mission is to shape the way people eat at work and create a movement of happier, healthier and more productive companies.
Zenjob is a mobile tech company that solves short-term staffing emergencies by providing hourly workers on-demand. Zenjob actually hires the workers and lends them out to companies. People working with Zenjob earn more than minimum wage and companies have less admin hassle and more flexibility than with traditional temp agencies.
Movivo is a platform that allows users to cover the cost of their mobile minutes by completing surveys, crowdsourced tasks and by downloading new mobile apps. Movivo works with many of the world’s largest telecoms operators and the service is growing quickly in a number of emerging market countries.
Job Pal builds chatbots that automate candidate engagement and pre-screening. Companies want to engage much more with prospective employees, but cannot due to a lack of resources. Meanwhile, recruiters mostly sift through irrelevant applications while they need to spend more time with relevant candidates. Job Pal solves both problems through machine intelligence.",2016-10-07,https://tctechcrunch2011.files.wordpress.com/2016/10/img_0360.jpg?w=738,berlin,500 Startups brings growth hacking program to Berlin
152,Natasha Lomas,"Art filter photo app Prisma is adding a big new feature to its iOS app in an update landing today: support for videos.
The app, which lets people turn their selfies into cartoonies by using deep learning algorithms to process photos in various graphic styles, quickly surged to millions of downloads in a viral splash after launching this summer. And just as quickly spawning a rash of fast following clones.
As well as creating arty selfies, users of the Prisma iPhone app can now turn snippets of video up to 15 second long into playable animations by selecting one of the nine filter styles currently available — and waiting for the app’s AI algorithms to weave a frame by frame transformation.
Turning a boring shot of a hallway into a moving comic book in a matter of minutes (as per the clip example below).
Videos can be recorded in the app or selected for processing from the camera roll. You’ll need iOS 10 for Prisma video to work, and a little patience as it can take more than a minute to process a clip depending on length, resolution and which model iPhone you’re using.
Android users will have to be more patient — as there’s still no support for video there.
Prisma says it’s planning to add offline photo processing to the Android app first, in “a week or so”, after which co-founder Aram Airapetyan says they’ll “jump on a video development”. “Android is a tough guy,” he adds.
Processing time for Prisma video on iOS is around two mins for the iPhone 6; 55-60 secs for iPhone 6s; and half a minute for iPhone 7, according to Airapetyan, although in my experience videos seemed to finish process a little quicker than that on average.
All processing is done locally on the device so expect your iPhone hardware to heat up a little as you play around with remixing videos as mosaics or Munches or manga-style cartoons.
Next up on Prisma’s iOS to-do list is adding a GIF creator — with looped video touted as coming “very soon”, aka later this month.
Rough round the edges 
Prisma video on iOS is just a beta launch at this stage, with Airapetyan touting improvements in quality coming down the pipe, and an expanded choice of art filters to style clips — adding their intention is to make all Prisma’s photo processing styles available for video, and add some new ones too.
They’re not first to the punch with art filtered video, though — others, such as the startup behind photo processing app PicsArt, got there before them. (In PicsArt’s case siloing video processing into a second standalone app, called Magic Video).
But Airapetyan is dismissive of rivals’ efforts. “We’re faster and better, taking into account the fact that we’re launching videos in beta, as the final quality will be much better,” he argues when asked how Prisma video stacks up against PicsArt’s take.
“We’ll also increase the photo styles’ quality within a couple of weeks,” he adds.
It’s fighting talk, but Prisma is clearly now having to play catch up with the competition, thanks to its early viral success.
At this beta stage the quality of Prisma video also has some rough edges. More polished looking results are possible with Magic Video — although personally I prefer the simpler Prisma interface vs all the toggles and layers available in Magic Video (but if you prefer a greater choice of editing options and tools you’ll likely disagree).
In a quick test of Prisma video ahead of the new feature launch I found results looked a little crude and were less immediately appealing vs Prisma’s art filtered photos — with a tendency towards producing flickery footage.
That said, as with the art photos, different Prisma filters can yield pretty radically different results, some of which look better than others. So you’ll want to spend some time playing around with different styles.
I found there was typically at least one style that looked interesting if not entirely pleasing. So there’s certainly fun to be had here, although perhaps less instant viral potential vs the snap and share gratification of art filtered selfies.
Here are a couple more test clips I made — using the ‘Gold Fish’ and ‘The Scream’ filters respectively:
And here’s a longer form video made by music group Tweed, apparently incorporates Prisma’s tech (although — take note — the app has a hard stop at 15 seconds of video, so you’re not going to be able to create anything as long form yourself using just Prisma, just yet)…
For both video and photos Prisma’s app does not offer as many granular controls for processing as PicsArt’s two apps do. But Prisma’s simplicity is very much part of the viral appeal here IMO. Nor does Prisma require you to register just to process a few photos… But sure, horses for courses — if you want a more fully featured image editing app then Prisma is not it.
Looking purely at the photo filter effects, I also personally prefer Prisma’s results — finding PicsArt’s results generally more garish. But again that’s a matter of personal taste.
Despite — or perhaps because of — its single feature focus, Prisma continues to rack up downloads. It tells TechCrunch it’s now had around 70 million downloads at this point, just over three months after launch.
Back in August it was running at 55M+ downloads — and the app’s early popularity attracted speculation over the summer about whether or not the team would raise VC funding to keep developing or else get snapped up a social platform giant like Instagram or Snapchat keen to beef up its own in-house content creation talent.
In the event, Prisma has done neither. Instead it has started monetizing usage via sponsored styles that are available in the apps.
Currently it has one sponsored filter launched (called Gett), with another slated as coming later this month. And the team does not seem as if it’s about to accept a big outside investment.
“I think we’re ok,” adds Airapetyan, responding to a direct question about whether they’re raising funding. But whether a new kid on the block app with millions of downloads but no social sharing platform of its own, and a bunch of copycats seeking to eat its lunch, can turn a cool feature into a sustainable business remains to be seen.",2016-10-06,https://tctechcrunch2011.files.wordpress.com/2016/10/device-comp.png?w=738,"prisma,art-filters,video,picsart","Prisma adds art filtered video, GIFs coming next"
153,Ingrid Lunden,"The Internet of Things — the area of technology where previously dumb objects are getting equipped with radio signals and microprocessors to be connected, monitored, controlled and supercharged through networks — is still in its early days, but one of the more interesting startups in the field is raising some significant money as it gears up to take a leading role in its future.
Sigfox, the startup out of France that is building a global network for connected objects that emit low-power signals, is seeking to raise between $100 million and $200 million, at a valuation of around $600 million, according to sources. The round is likely to be closed by the end of this year, possibly as soon as next month, according to the company’s CEO and co-founder Ludovic Moan.
The news comes at the same time that Sigfox is unveiling an identity rebranding, where it is positioning itself as a network not just for connected objects, but as a provider of connectivity for digital services, specifically seamless and more efficient handoff between different networks, for example.
On top of solving some of the more immediate needs for connecting objects and networks, Sigfox has very lofty ambitions to do even more. The company believes that its architecture, which is not based on the operator’s view of network connectivity, could help eliminate data roaming, the cost and complexity of silicon for connecting objects, and even the need for batteries in devices.
(Sidenote that I promise I am not making up: Moan is a big disciple of the Simulation theory and also believes that his company could play a role in enabling our constructed existence. “[The simulation] is part of the vision that I have, and I want Sigfox to be able to stay true to this,” he said. “This world is virtual. At the end of the day we are not living in the real world.”)
TechCrunch learned of the new financing round and has confirmed the details with sources close to Sigfox and then confirmed it with the company. The round is expected to include at least one strategic investor out of China and “some familiar faces.”
The Chinese investors are of particular interest to Sigfox as it continues to build out its global network. The company is already live in 24 countries — including a 100-city deployment in the U.S. — and plans to bring that to 30 in the near future. Moan — who confirmed the fundraising when I asked him about it directly — also told me that China and India, huge markets for mobile and wireless services, are very much in its sights as a part of that.
To date, Sigfox has disclosed around $150 million in funding with its last valuation at around $400 million. Existing investors include typical financial backers like Elliott Management and Partech Ventures, as well as a long list of strategic investors including utility giants Air Liquide, chip and equipment makers like Intel and Samsung, and a host of service providers like Eutelsat, Japan’s NTT and Telefonica.
The company has made waves in the industry up to now by providing an alternative network and model to the flavor of IoT that is being put forward by carriers. Carriers, of course, are looking to IoT as a route to adding more data traffic to their existing networks. On top of this they are hoping to build out their services businesses to integrate and help run those IoT systems on behalf of other organizations. That makes sense, since the basic data connectivity for connected objects is a low-margin business.
And if IoT is a game of scale, Sigfox is hoping to be the biggest. The company’s pricing starts at €1 per device per month up to €1 per device per year (with a sliding scale based on volume), and it already has over 8 million low-powered devices registered on its network, which covers 1.35 million square kilometers and 358 million people.
It also says that it works with 1,000 partners that include network operators, component manufacturers, integrators and platform developers as part of its business, and that 250 startups are currently developing IoT projects implementing its connectivity. Existing projects include the BT.TN universal button, water management services and connected home initiatives.",2016-10-06,https://tctechcrunch2011.files.wordpress.com/2016/10/sigfox-logo.jpg?w=738,,IoT startup Sigfox is raising $100M-$200M at a $600M valuation to grow globally
