,authors,content,date,img_src,tags,title
102,Jon Russell,"Singapore-based Greyloft has raised $1.1 million to build out its vision of what a real estate agency should look and function like in today’s digital era.
Wait! Estate agents? Aren’t they the bad actors that spoil things for everyone?
It’s true that many startups attacking the real estate have chosen to disintermediate agents on the premise that their motivations are misaligned with those of the consumers they represent. At their worst, their goal is often to maximize their take-home of a deal, rather than satisfying their client 100 percent. India’s NoBroker, which raised $10 million earlier this year, is probably the best example of that ‘direct-to-consumer’ model.
Greyloft believes that it can solve the problem by bringing agents under its own roof and this seed stage financing, which was provided DSG Consumer Partners, Wavemaker, Cub Capital, Tigris Capital and JFDI, will help it build on its early promise.
The startup was founded last year by ex-bankers Siddhesh Narayanan (CEO) and Archit Agarwal (CTO), who explained the vision as more of a ‘real estate 2.0’ than online property portal. In its system, it works with a selection of closely affiliate licensed agents who are incentivized to put the customer first, changing a dynamic that many believe is broken.

Left to right: Greyloft founders Archit Agarwal and Siddhesh Narayanan
Greyloft focuses on two pieces for its business: giving consumers — buyers and sellers — a platform for home rentals and sales, on the other side it generates leads and business for real estate agents.
“We are doing every single thing an estate agency does, but much smarter,” Narayanan said in an interview.
The company aims to attract agents by offering a CRM system that does some obvious things that real estate professionals don’t currently get access to using their existing setups, which are predominantly offline and analog. That includes software that manages multiple deals, transitions clients between colleagues, keeps track of paperwork, and can track client requests, meaning that agencies can take requests months in advanced.
“Once they get used to the backend systems… it allows them to focus on customer service not being a push salesperson as agents are sometimes known for,” Agarwal said.
Narayanan admitted that it is challenging finding the right brokers in Singapore since there is a small pool who are licensed, and Greyloft’s own approach takes some explaining. But, all things considered, the startup’s founders see the right kind of agents as essential to the process.
“Buying property is one of the biggest decisions you’ll make in your life, and rent is also one of the biggest items [of expenditure] out there. You need an expert to advise you,” Narayanan argued.
With its new funding secured, the company is aiming to “step on the pedal a little and get more customers to know us.” That will involve the creation of a dedicated sales team in Singapore and potentially exploring possible overseas expansion plans. Right now, Greyloft outsources its technology in India while it has a customer services team that is based in the Philippines.
Singapore is no easy market to win, however. More establish rivals include iProperty, which was bought by News Corp for over $500 million, PropertyGuru, which raised $129 million in its most recent funding in 2015, while there is also 99.co, a startup backed by more than $1.6 million from investors like Facebook co-founder Eduardo Saverin.",2016-09-28,https://tctechcrunch2011.files.wordpress.com/2016/09/condo-browsing.jpg?w=738,"real-estate,property,singapore",Singapore’s Greyloft lands $1.1M to build a real estate agency for the digital era
103,Jon Russell,"Afters years of waiting, Spotify has finally launched its music streaming service in Japan. We reported earlier this month that the launch would happen before September is out, and the company just about delivered on that timeframe.
Spotify has had an office in Tokyo for at last 18 months, but protracted negotiations with record labels and the music industry have seen competitors like Apple, Line and Rakuten sneak in first with rival services. Now Spotify has joined its ranks with its free service and the paid-for option which costs 980 yen ($9.60) a month.
Japan is a hugely lucrative market for music. Sales are estimated at nearly $3 billion per year which makes it the world’s second largest market behind only the U.S., but Japanese consumers prefer to buy their musical physically, in the form of CDs, than digitally right now. Streaming service providers are viewing that as an opportunity rather than a threat, and success in Japan could give Spotify some momentum headed into 2017 when it is expected that the firm will make efforts to go public.
Spotify recently passed 40 million paying customers, and it’ll be aiming to add a large chunk more to that number from Japan.
It its favor, it is the one mainstream streaming service in Japan that has a free-tier option for users. That goes some way to explaining why it has taken so long for the Swedish company to secure deals with record labels, but it could be a factor that helps its service gain some momentum in the country among users who are not used to paying for digital music consumption.
This launch represents Spotify’s second major expansion in Asia this year. Back in March, it entered Indonesia, the world’s fourth most populous country, ending a quiet spell in the continent. Spotify first entered Asia in 2013 with launches in Hong Kong, Singapore and Malaysia, but, prior to 2016, it had only expanded to one new market since then: the Philippines.
We’ve heard whispers from inside Spotify that India is its next market of focus for Asia, although we understand that the company is studying the market and doesn’t have concrete plans for a launch right now. It might do well to observe Google’s efforts after the search giant launched its Google Play Music service in the South Asian country this week.",2016-09-28,https://tctechcrunch2011.files.wordpress.com/2015/11/shutterstock_226042204.jpg?w=738,"music-streaming,streaming,japan","Spotify finally launches in Japan, the world’s second largest music market"
104,Jon Russell,"Didi Chuxing, China’s largest ride-hailing company, has hired two distinguished security experts to lead a new U.S.-based research center as part of a major push to increase its data security efforts.
Dr Fengmin Gong, whose 30 year work history includes starting Palo Alto networks, and Zheng Bu, who worked with Gong at FireEye and spent time with McAfee among employers, have taken key positions at the company, Didi announced today.
Gong becomes Didi’s VP of information security strategy and vice president of the company’s new U.S.-based Didi Research Institute. Bu will be based in China where he’ll work directly with Gong as Didi’s VP of information security operations. In that role, he’ll manage the company’s existing information security team in China.
Didi, which is in the process of acquiring Uber’s business in China, formally unveiled a China-based center in December 2015, but little is known about its U.S.-based branch. The company isn’t saying a great deal at this point.
A spokesperson said the center will be “a unit that helps to enable business inside rather than just focus on security” while Gong himself explained that he and Bu will “take responsibility for overall security” within the company.
“We have detailed plans we are working on,” Gong told TechCrunch. “Clearly Silicon Valley is best place to attract many talents [and a] much better vantage point to see the demands and needs across the globe.”
Gong has spent most of his life working in enterprise security environments, but he said that he and Bu were attracted to Didi principally because of the scale of the company’s business. Didi said this summer that it has over 14 million drivers and 300 million active users with 10 million rides completed on its service each day.
“The Didi platform and service it provides and number of people and partners in touches, presents probably the most sophisticated customer use case,” Gong explained. “[Bu and I] have been working in security for traditional enterprise, [this is the first opportunity] that represents a good blend of enterprise and new-age internet-based sharing economy. Plus we were very impressed by Didi’s ambition and ability to execute.”
Didi has an alliance with fellow Uber rivals Lyft in the U.S., Ola in India and Grab in Southeast Asia which includes a roaming deal for its users across different services and an exchange of information and best practices. While Didi’s deal with Uber has cast considerable doubt on the strength of that union, Gong said that he is “expecting” to engage in dialogue with those three companies as he settles into his new role.
Interestingly, driver and passenger fraud is one area that Gong said will fall under his reach. Beyond simply safeguarding the data and passengers and drivers — such as driving licenses and sensitive travel information — from outside threats and operational data security management, the new push will aim to cut down the massive problem of ride fraud.
With vast subsidies on offer for drivers and passengers, the Chinese internet is awash with offers to spoof rides and split the proceeds between fake rider and fake driver. This is an issue that has dogged both Didi and Uber China. Uber said last year that fraud accounts for 10 percent of all bookings in China, but experts have estimated the problem to be multiples higher. It isn’t clear how widely fraud impacts Didi’s business today after it raised prices and cut some subsidies following the Uber China deal, but Gong and his team will certainly “enable” business at Didi if they are able to stamp out even a fraction of fake rides.",2016-09-28,https://tctechcrunch2011.files.wordpress.com/2016/09/didi-2.jpg?w=738,"infosec,security",Didi Chuxing makes information security push with new U.S. research lab and hires
105,Jon Russell,"If you travel a lot, or even just a little, you’ll be sick of roaming bills, or frustrated by the inconvenience of the cheaper alternative: buying a local SIM and switching it with your regular one. Hong Kong-based Tink Labs believes it has a better solution, a designated mobile device in your hotel room that you can use for free, and it has raised a whopping $125 million to expand its idea to cover more hotels worldwide.
The new financing was providing by existing investor and manufacturing giant Foxconn (via its FIH Mobile unit), with participation from Sinovation Ventures, the investment firm from ex-Google China head Kaifu Lee, and Cai Wensheng, a prolific angel investor who is Chairman of popular Chinese photo service Meitu.
Tink Labs CEO 24-year-old Terence Kwok declined to provide the company’s valuation, but hinted that it is above $500 million.
“We’re not a unicorn yet, but are more than halfway there,” he said.
That would make it the highest-valued tech startup in Hong Kong, and certainly one of the most notable in Asia, yet Kwok is happy to remain discreet and focused on business.
“We’ve kept a low profile even though there’s a consumer element to the product,” he said.
Tink Labs began as a device rental service that targeted travelers at airports, but Kwok said it pivoted when the team found that the business wasn’t as scalable as hoped.
“We quickly released people just want to get the hell out of the airport,” he said.
It remained focused on travelers, but moved its touch point to hotels where it has founded traction, raising over $170 million from investors to date, today’s announcement included, and working with major groups like Starwood, Accor, Shangri-la, and Melia.
Tink Labs’ flagship product is Handy, a smartphone for hotel guests that takes the pain out of mobile roaming. You can make calls and send messages like a normal phone, but it also includes details of services available at your hotel and nearby activities. It even hooks into the hotel’s telephone system so you can order room service before you get back to your room, call a colleague via their room number, or phone the helpdesk if you’re out and about but need help talking to a taxi driver in the local language.
It’s a neat two-way model: guests get a device and free services, while hotels get a powerful channel through which they can engage their guests.

All of this comes for free because hotels are sold on the idea that Handy can increase their engagement with guests, which translates to higher spending.
A hotelier’s dream is a guest who not only stays in their rooms regularly, but uses facilitates and services like the on-site spa, steak house or minibar. That’s the kind of guest who generates serious revenue.
Four-year-old Handy believes it can deliver on that mission.
It touts a two-year independent study which, it said, found that guests would spend an additional $21 per night on average when staying in a room that includes a Handy device.
Kwok told TechCrunch in an interview that typically 30 percent of guests who stay in a room with a Handy will engage with hotel information via the device. Compare that to your own experience — when was the last time you opened that gigantic book of hotel services?
The Tink Labs CEO reckons that less than 10 percent of guests go down the traditional route and open the book of services. That severely limits additional revenue than a hotel can make. Tink Labs charges hotels an undisclosed subscription fee — “it’s certainly nowhere near $21,” Kwok said — which can help them increase their revenue. That fee varies based on the requests of a hotel, though its important to note that hotels are forbidden from charging guests to use a Handy.
Tink Labs works with Foxconn to produce its devices, but it is changing things up with plans to introduce phones next year that it has designed itself. Right now its devices are fairly standard although they run on a “modified version of Android that is heavily, heavily customized,” Kwok said. He’s ready to takes things further and from April next year the company will give hotels bespoke devices under its own brand that can do things like control the TV set in a hotel room, and more.
Beyond developing specialist hardware, Kwok said he intends to triple the current team of 150 people and expand its reach of seven international offices to go after more hotel partners across the world.
Right now, the Handy service is in over 100 hotels with nearly one million people using Handy devices each month, the company said. It started off focused on Asia, and Kwok said Handy is present is half of the hotels in Singapore and Hong Kong, while its reach in London is at nearly 25 percent. The goal is now to expand that presence into other tourist and traveler spots and beyond.
Updated 09/28 5:15 PDT to correct Handy business numbers",2016-09-28,https://tctechcrunch2011.files.wordpress.com/2016/09/handy-1.jpg?w=738,"smartphone,hotel,tink-labs",Tink Labs raises $125M to put its free-to-use smartphone in more hotel rooms worldwide
106,Steve O'Hear,"Headed up by Kaidi Ruusalepp, who was previously CEO of the Nasdaq Tallinn stock exchange, Estonia’s Funderbeam is on a mission to build what she calls a “funding and trading engine for growth companies”.
Providing tools to research, fund and trade in private companies, the bigger vision is to build something akin to a “stock exchange” for startups based on blockchain technology. To make that vision a reality, Funderbeam has raised $2.6 million in further funding.
Leaning the round is Draper Associates, Thomson Reuters, and IQ Capital, with participation from an array of previous Funderbeam backers, such as 3TS Capital Partners. Notable other investors include Skype co-founder Jaan Tallinn, and David Braben, the CEO and Founder of Frontier Developments.
“There’s too much complexity in the pre-IPO/private market. Companies used to go to exchanges for growth financing, but looking at the startup funding trends, like Uber raising €3.5 billion in just one round, plus the cost structure of getting listed and being listed, it does not make sense anymore,” Ruusalepp tells me.
“Today growth companies look to the stock markets only as a serious option for exits. On top, early-stage and growth funding has grown to unimagined heights, but it is one of the most illiquid assets classes. Once you’re in, you hardly get out”.
This of course is where Funderbeam comes in. The platform is part research tool — the first part of the problem the startup set out to solve when it launched in 2013 — and part investment platform, providing a way for startups to raise funding and for investors to invest in burgeoning and potentially high growth companies.
But to truly solve the liquidity problem, there needs to be a transparent and trustworthy platform for secondary trading, and one that can work across borders. And this is where Funderbeam’s nascent trading feature comes into play. It lets shareholders sell their stake in a startup, either one that was originally funded via the platform or potentially any that they have permission to trade.
“Using blockchain technology we aim to show the stock markets how technology can turn the sector around. For the first time ever, early stage investors can choose both how much to invest, and how long to keep the investment,” explains Ruusalepp. “Or to put it in a fruitier way,” she says, “imagine if Bloomberg, Angellist and Nasdaq had a baby”.
Blockchain technology, argues Ruusalepp, provides the transparency needed to help address trust issues inherent with any trading system and that digital technology trumps paper records that still hamper stock exchanges and databases of company ownership.
“There is a coming shift in trust [that is seeing] customers start trusting technology instead of people and institutions,” she says. “As the internet is for exchanging data and information, blockchain is being placed one level higher – it is used to exchange values. It’s like a global public notary registering and keeping an eye on all global transactions on assets”.
That “fundamental vision and usage opportunity” for blockchain is something Funderbeam and its investors are embracing. “We decided to test it, to be the first one who has built a securities trading platform on the blockchain,” adds Ruusalepp.",2016-10-12,https://tctechcrunch2011.files.wordpress.com/2016/10/funderbeam-team-1-of-1-1.jpg?w=738,,Estonia’s Funderbeam is building a blockchain-based “stock exchange” for startups
107,Lora Kolodny,"Noodle Partners Inc., a new education venture from the founder of The Princeton Review and 2U Inc., John Katzman, has raised $4 million in venture funding to help colleges and universities deliver high-quality certificate and degree programs online.
Philadelphia-based Osage Venture Partners led the investment in Noodle Partners and was joined by New Markets Venture Partners, 500 Startups and others.
Katzman tells TechCrunch that the challenge in delivering online education at the college and university level has changed dramatically over the last decade, and not just because of the rise of smartphones.
“People did not believe that higher ed could be as good online as a campus-based program. That’s because the first wave was full of for-profits that were just not very good schools. Today, there are many great schools online and we know the problem is not the medium. The new challenge is building and offering programs that are great, but also lower the cost of higher education,” Katzman said in 2008, when he co-founded 2U Inc. with Chip Paucek and Jeremy Johnson.
Trump University, and the University of Phoenix (owned by Apollo Education) are two famous examples of unscrupulous, for-profit online schools in that earlier wave. These organizations sold students on useless degrees and costly seminars that would leave them more in debt than anything else.
College enrollment in the U.S. has declined for five straight years, according to the most recent available data from the National Center for Education Statistics. That correlates with a 34% increase in the cost for undergraduate tuition, fees, room, and board at public colleges and universities, and a 25% increase at private non-profit institutions between 2004 and 2014.
Katzman believes that offering more of their degree programs online, and at a higher quality than ever before, will help colleges reverse that trend.
New York-based Noodle Partners offers colleges and universities help setting up an online degree program, instructional design for courses within the program, recruiting, tech support, and measuring student engagement along the way to course completion. The startup charges for setup and a flat fee per student.
Other companies doing this work (called “online program management”) will typically take a large percent of tuition they help schools generate from their online offerings, cutting into the school’s already challenged margins.
Competitors to Noodle Partners include 2U, the company Katzman started but with which he is no longer affiliated, Academic Partnerships, HotChalk, Keypath, Pearson Embanet, Wiley Education Solution and others.
Osage Venture Partners’ Nate Lentz said he backed Noodle Partners believing, “Something needs to change the cost curve in higher ed.”
The investor expects Noodle Partners to use its funding to roll out its OPM services and technology to top colleges and universities in the U.S., and expand enrollment in online programs at the schools where the company is already working today.",2016-10-12,https://tctechcrunch2011.files.wordpress.com/2015/02/graduates.jpg?w=738,"edtech,higher-ed",Noodle Partners raises $4 million to help colleges deliver degrees online
108,John Biggs,"The promise of 3D printing has been kind of a dud. Aside from a few cool Yoda heads and some small plastic pieces, there have been no “indie” players doing much interesting in the space except Markforged. Markforged is a Boston company we featured last year that makes carbon-fiber reinforced plastic parts using traditional 3D-printing techniques. This means the objects they print are stronger, lighter and more resilient than steel.
Now they’ve added “more precise” to that list. The Markforged Mark X is a unique 3D printer that uses laser scanning to ensure pieces that come off the machine are precisely as ordered. In other words, you can send objects that will get the “the strength and quality you’re expecting,” says founder Greg Mark, an aerospace engineer and MIT grad.
“We invented Continuous fiber reinforcement (10 issued patents), and in-process laser-micrometer quality control,” he said. “We’ve also pushed the surface finish of plastic extrusion to approach the surface finish of SLA. Now there’s one machine that combines the strength, surface finish, and quality control to enable end use parts. Supply chains will never be the same.”
Essentially the system prints very fine, very strong objects and constantly tests them for structural accuracy. When you send an object to the $68,000 printer, it ejects exactly the part you requested with exactly the right measurements.
“The in-process quality control is based off a laser micrometer integrated into the print head. With 1 micron Z axis resolution, and 50 micron X/Y resolution, you get high-resolution scans of your part, which you can pull dimensions off of in real time or use to check the accuracy of the part,” said Mark.
The system has two print heads, one for plastic and one for carbon fiber. You can set the hardness of the object while you manufacture it and, more importantly, you can control how light the object is. I’ve seen many Markforged products and they’re as solid as steel but as light as plastic. They’re surprisingly cool. Thanks to the measurement system you can basically send objects to a printer in your office or a thousand miles away and ensure that the object that comes out is exactly as you designed it and has unrivaled strength. In other words, instead of sending a milled piece of steel you can send and print a digital file.
Current Markforged owners will get a discount on the Mark X but, given this thing is almost $70,000, I doubt many hobbyists will pick one up. It’s still one of the coolest implementations of 3D printing I’ve seen, however, and it’s pretty darn close to teleportation.",2016-10-11,https://tctechcrunch2011.files.wordpress.com/2016/10/screen-shot-2016-10-11-at-3-43-52-pm.png?w=738,"business,technology,office-equipment",The Markforged Mark X lets you teleport precision custom parts from designer to printer
